offset,text_target
0x51932,"A festa continua bem depois da meia-noite, sem\n"
0x51965,sinal de parar...
0x51982,Saí para esfriar um pouco no ar da noite.
0x519b5,"Uma brisa passa, acariciando meu rosto..."
0x519df,Ufa...
0x519e7,O ar fresco no corpo é bom depois de tanto tempo\n
0x51a1d,dentro da estalagem abafada.
0x51a3d,"Atrás de mim, luz quente e vozes animadas filtram\n"
0x51a70,da festa lá dentro...
0x51a86,"Prestai-me atenção, amigos! Admirai como eu,\n"
0x51ab6,"mestre das imitações, imito o nosso querido Ukon!"
0x51aeb,A plateia vai ao delírio.
0x51b04,Parece que o Maroro está fazendo alguma apresentação.
0x51b37,"Uma atmosfera tranquila finalmente toma conta, depois\n"
0x51b6c,de tudo que aconteceu...
0x51b8a,Todo mundo parece animado.
0x51ba3,"...Animados, hein."
0x51bb5,Os rostos dos dois homens que falaram comigo durante\n
0x51bec,durante a viagem vêm à minha mente.
0x51c13,Coorte do Ukon
0x51c21,"Ei, garoto, essa mocinha vai se decepcionar com\n"
0x51c55,você se falar assim.
0x51c70,É isso! Um homem de verdade aguentaa firme e vai até\n
0x51ca4,o fim!
0x51cab,E então riram animadamente com os seus\n
0x51cd8,camaradas.
0x51ce2,Mas...
0x51ce9,Aqueles dois não estavam em lugar nenhum no salão\n
0x51d1b,há pouco.
0x51d2b,Eles nunca mais vão poder rir ou beber com\n
0x51d61,os companheiros...
0x51d79,"Mesmo assim, todos lá dentro riem e comemoram\n"
0x51dae,"sem nenhuma preocupação, de alguma forma."
0x51dd4,Ninguém parece pensar em lamentar os que se foram.
0x51e06,Até a Kuon não parece muito abalada...
0x51e2d,E...
0x51e34,"Mesmo depois de tudo aquilo, eu também não\n"
0x51e67,me sinto lá muito afetado.
0x51e96,"Hm? O que faz aqui fora, garoto?"
0x51ebb,Viro para a voz e vejo Ukon se aproximando\n
0x51eed,com uma garrafa de sake numa das mãos.
0x51f1f,"Saiu para tomar um ar, hein?"
0x51f48,"Algo assim, sim."
0x51f63,"Entendo. Ei, que tal caminhar um pouco comigo?"
0x51f8f,Acompanho Ukon pelo caminho escuro...
0x51fba,"Caminhamos ao luar, projetando sombras longas na\n"
0x51ff0,noite azul-escura.
0x5200a,"Ei, garoto. Tenho uma coisa a te perguntar--\n"
0x5203f,Essa moça que viaja com você. Quem é ela?
0x5206d,A Kuon?
0x5207c,Isso. Achei que você soubesse algo.
0x520a6,Por que o interesse nela?
0x520c4,"Eu mesmo não sei, honestamente. Acho que sou\n"
0x520f7,curioso assim.
0x52105,"Você não está caindo de amores, está?"
0x5212a,"Ela é uma mulher linda, sem dúvida, mas não sinto\n"
0x5215b,atração por ela do jeito que você está\n
0x52189,pensando.
0x52193,"Além disso, dar em cima dela seria um pouco..."
0x521bd,Um...?
0x521c4,"Bom, deixa pra lá. Ela é uma mulher incrível, sim."
0x521f9,"O APETITE dela é incrível, talvez."
0x52218,"Ha! Não era isso, mas você não está errado.\n"
0x5224b,Me refiro mais à aura dela. A forma como ela se porta.
0x5227f,"Essa coragem, a falta de hesitação diante de\n"
0x522b2,uma situação de vida ou morte...
0x522d7,Dá pra imaginar que tipo de vida ela levou.
0x52305,"Com isso, a voz de Ukon fica quieta."
0x5232c,"Pensando bem, eu realmente não sei muita coisa\n"
0x52360,de Kuon.
0x5236c,"Devo a vida a ela, e não quero me intrometer,\n"
0x523a0,então nunca perguntei sobre o passado dela.
0x523cf,"...Não sabe nada, hein. Bom, vocês se conheceram\n"
0x52405,faz pouco tempo. Não tem como saber mesmo.
0x5242e,Ela se diz uma simples boticária...
0x52455,"Quando ela disse isso, quase soltei: ""onde\n"
0x5248b,"existem boticárias como você no mundo?"""
0x524ba,"Logo depois, Ukon para."
0x524dd,...Onde estamos?
0x524ee,Um pouco fora da aldeia. Grandes pedras fincadas\n
0x52523,enfileiradas em colunas regulares...
0x52550,Isso é... um cemitério?
0x52568,Desculpe por te trazer a um lugar tão sombrio.\n
0x5259a,Não conseguia descansar sem trazer um sake pra eles.
0x525cd,"Ukon para diante de uma pedra em especial,\n"
0x525fd,decorada com enfeites coloridos.
0x52624,"Oferendas de flores, comida e bebida estão dispostas\n"
0x5265a,ao redor.
0x52665,...Desculpa pela demora. Acho que acabei sendo\n
0x5269a,o último...
0x526aa,"Ukon murmura baixinho, como se falasse\n"
0x526de,com a pedra tumular à sua frente.
0x52701,Então essas oferendas foram deixadas pelos outros\n
0x52733,grupo...?
0x5273f,Parece que os outros vieram prestar respeitos antes\n
0x52774,do Ukon.
0x5277e,Nem todo mundo lida bem com essas coisas sombrias.
0x527ae,"Quando despedimos alguém, fazemos isso com sorriso\n"
0x527e2,e alegria. Foi o que decidimos... juntos.
0x52813,Sim.
0x5281a,"...É. Não devia ter sido fácil para ele,\n"
0x5284c,perder tantos companheiros...
0x5286c,Ninguém sabe quando ou como a morte pode nos\n
0x5289e,"levar. Se morremos em batalha, nossos corpos podem\n"
0x528ce,podem...
0x528d8,Mas fico feliz de poder ao menos oferecer aos\n
0x52906,homenageá-los.
0x52918,"Ukon dobra um joelho, murmurando uma oração."
0x52943,"Seguindo seu exemplo, ajoelho ao lado dele e faço\n"
0x52978,oro em silêncio.
0x52987,"Testemunho o fim do seu tempo neste mundo. Descansai,\n"
0x529bd,para que possamos beber juntos em Kotuahamuru.
0x529ed,...Ukon?
0x529f6,Tudo bem.
0x52a01,"Vamos voltar e encher a cara, hein, garoto?"
0x52a2d,Hein? Tá...
0x52a3a,"Confuso, sigo o Ukon enquanto ele parte pelo\n"
0x52a6e,caminho de volta.
0x52a7e,...Que sensação estranha foi essa agora...?
0x52aac,Enquanto me afasto do cemitério...
0x52ad1,...Não consigo deixar de notar um amamunii entre\n
0x52b02,"as oferendas, recheado demais para comer\n"
0x52b33,de uma vez.
