offset,text_target
0x179a45,"Seus dias de vilania acabaram, Moznu!"
0x179a6c,"Grr, agh, *tosse*... Maldi챌찾o tudo isso..."
0x179a93,"Sim! Gra챌as 횪s bombas de fuma챌a da Kuon, tudo\n"
0x179ac3,correu perfeitamente.
0x179add,Reunimos todos os bandidos inconscientes\n
0x179b07,e amarr찼-los.
0x179b18,"Quase sem resist챗ncia, terminamos\n"
0x179b47,em um instante.
0x179b53,...Aquela fuma챌a realmente foi nosso trunfo.
0x179b81,...Essas pessoas v찾o ficar bem mesmo?
0x179bb3,"Eh, nada que ameace a vida... Acho."
0x179bdc,Acho...?
0x179bea,"Kuon n찾o sabia como ia acabar, e foi\n"
0x179c1d,n찾o era como se test찼ssemos antes.
0x179c46,Agora s처 falta entreg찼-los\n
0x179c74,justi챌a.
0x179c7d,Argh...
0x179c85,Aproveitem a estadia na pris찾o para refletir\n
0x179cb8,pelos seus crimes contra o nome dos Bandidos Nosuri.
0x179ce9,Espera um segundo.
0x179cf8,*Clique*
0x179cff,"Quando Nosuri come챌a a marchar em dire챌찾o ao Moznu, a paro\n"
0x179d30,dela e estalo os dedos.
0x179d49,Q-Que... Quem s찾o todos esses--\n
0x179d69,Espera! O que voc챗s...!? P-Parem...\n
0x179d8d,ESPEEEEEEEEEEERA!!!
0x179da4,"De repente, Ougi e os Bandidos Nosuri surgem das\n"
0x179dd8,sombras... e come챌am a despir Moznu e seus\n
0x179e0b,bando de todos seus roupa.
0x179e26,Iiih!?
0x179e2d,O-O que voc챗 est찼...?
0x179e45,...E o que exatamente 챕 isso?
0x179e62,Oogh... Creio que vou ficar enfermo.
0x179e89,Todo mundo parece horrorizado com a cena que se passa.\n
0x179ebf,Todas as garotas desviam apressadas os olhares.
0x179ee8,O-O que 챕 tudo isso?
0x179efd,O toque final. Precisamos deixar isso o mais\n
0x179f2c,convincente poss챠vel.
0x179f44,Convincente? O que vai ser convincente nisso\n
0x179f76,uma horda de malandros nus...?
0x179f91,"Se os levarmos agora, vai parecer que\n"
0x179fc4,derrotamos um grupo comum de bandidos.
0x179fee,Precisa ficar bem claro que esse cara foi\n
0x17a021,fingindo ser o l챠der dos Bandidos Nosuri...
0x17a04f,횋 por isso que--
0x17a05e,QUE PORRA 횋 ESSA!?
0x17a06e,"Antes de terminar, ou챌o Moznu gritando\n"
0x17a09d,anguistia.
0x17a0a6,Nosuri olha de lado para ver o que est찼 acontecendo...\n
0x17a0d6,e congela.
0x17a0e3,"Q-Q-Que merda voc챗s acham que est찾o fazendo,\n"
0x17a111,me vistindo assim!?
0x17a12c,Diante dele est찼... um Moznu completamente novo.
0x17a150,"Ele est찼 vestido com as mesmas roupas da Nosuri,\n"
0x17a17e,com o rosto coberto de maquiagem.\n
0x17a19e,A vis찾o 챕... arrebatadora.
0x17a1b9,J찼 lutei em v찼rias guerras... mas nunca\n
0x17a1eb,ainda nunca vira nada t찾o p챕ssimo...
0x17a213,Atuy corre apressada para o canto mais distante\n
0x17a242,찼rea no momento que o v챗.
0x17a260,Bleaaarghhh...
0x17a26e,O-O que exatamente 챕...
0x17a284,...Isso 챕 cruel e incomum.
0x17a2a2,O nojo 챕 evidente na voz de todo mundo.\n
0x17a2cf,Nekone e Rulutieh... parecem estar completamente\n
0x17a301,perda.
0x17a307,"...OK, acho que estamos prontos."
0x17a327,Prontos pra QU횎!? O que diabos voc챗s est찾o planejando\n
0x17a359,em fazer comigo depois de me vestir NESSA merda!?
0x17a389,"Com todos disfar챌ados assim, ficar찼 claro\n"
0x17a3ba,que estavam se passando por...\n
0x17a3e2,"uh, Nosuri?"
0x17a3ee,"Ignorando os gritos do Moznu, olho para o lado.\n"
0x17a41d,"Nosuri est찼 tremendo, como se estivesse 횪 beira de\n"
0x17a44c,l찼grimas.
0x17a453,M-Minha roupa de bandida...! E-Eu guardava isso para\n
0x17a485,uma ocasi찾o especial!
0x17a499,A-Aaaaah!? O-O que voc챗 t찼 fazendo comigo AGORA!?
0x17a4c4,"Ei, calma! A gente acabou de espremer tudo dele\n"
0x17a4f3,nisso n찾o!
0x17a4fe,Voc챗 t찼 maluco!? I-Isso saiu do MEU guarda-roupa!
0x17a530,"횋 um mal necess찼rio. Desculpe, mas vai ter que\n"
0x17a563,apenas desiste.
0x17a574,Consigo segurar Nosuri antes que ela recupere suas\n
0x17a5a7,roupa do Moznu.
0x17a5bb,Ela fita Moznu com olhos vazios por um\n
0x17a5ea,"um tempo, depois se desaba fraco no ch찾o."
0x17a613,M-Meu conjunto favorito... Custou quase tudo\n
0x17a642,minha poupan챌a para satisfazer aquele comerciante...
0x17a669,E-E agora... est찼 destru챠do... Nunca mais vou conseguir\n
0x17a69a,vesti-la novamente...
0x17a6ae,"Ougi, que parece ter terminado o servi챌o,\n"
0x17a6dd,coloca uma m찾o reconfortante em seu ombro tremendo.
0x17a70f,"Sei como isso deve ser dif챠cil, mas voc챗 precisa\n"
0x17a741,entender que foi pelo bem maior.
0x17a76e,Mas... Mas...
0x17a77c,Tenho a impress찾o de que ela n찾o ouviu uma palavra\n
0x17a7ac,"da minha explica챌찾o... Ah, bem."
0x17a7cb,"Certo, hora de fechar isso--"
0x17a7ed,"E-Espera um segundo, maldi챌찾o!\n"
0x17a80a,"V-Voc챗 n찾o vai me entregar assim, vai!?"
0x17a83d,Claro que sim.
0x17a84b,N찾o assim... N-N찾o!\n
0x17a864,Qualquer coisa menos ISTO! POR FAVOR!!
0x17a880,Levem eles. E fa챌am bonito na hora de arrastar\n
0x17a8b2,l찼 dentro. Garante que todos vejam.
0x17a8e0,N횄횄횄횄횄횄횄횄횄횄횄횄횄횄횄횄횄횄횄횄횄횄횄횄횄횄횄횄횄횄횄횄횄횄횄횄횄횄횄횄횄횄횄횄횄횄횄횄횄횄횄횄횄횄횄횄횄횄횄횄횄횄횄횄횄횄횄횄횄횄횄횄횄횄횄횄횄횄횄횄횄횄횄횄횄횄횄횄횄횄횄횄횄횄횄횄횄횄횄횄횄횄횄횄횄횄횄횄횄횄횄횄횄횄횄횄횄횄횄횄횄횄횄횄횄횄횄횄횄횄횄횄횄횄횄횄횄횄횄횄횄횄횄횄횄횄횄횄횄횄횄횄횄횄횄횄횄횄횄횄횄횄횄횄횄횄횄횄횄횄횄횄횄횄횄횄횄횄횄횄횄횄횄횄횄횄횄횄횄횄횄횄횄횄횄횄횄횄횄횄횄횄횄횄횄횄횄횄횄횄횄횄횄횄횄횄횄횄횄횄횄횄횄횄횄횄횄횄횄횄횄횄횄횄횄횄횄횄횄횄횄횄횄횄횄횄횄횄횄횄횄횄횄횄횄횄횄횄횄횄횄횄횄횄횄횄횄횄횄횄횄횄횄횄횄횄횄횄횄횄횄횄횄횄횄횄횄횄횄횄횄횄횄횄횄횄횄횄횄횄횄횄횄횄횄횄횄횄횄횄횄횄횄횄횄횄횄횄횄횄횄횄횄횄횄횄횄횄횄횄횄횄횄횄횄횄횄횄횄횄횄횄횄횄횄횄횄횄횄횄횄횄횄횄횄횄횄횄횄횄횄횄횄횄횄횄횄횄횄횄횄횄횄횄횄횄횄횄횄횄횄횄횄횄횄횄횄횄횄횄횄횄횄횄횄횄횄횄횄횄횄횄횄횄횄횄횄횄횄횄횄횄횄횄횄횄횄횄횄횄횄횄횄횄횄횄횄횄횄횄횄횄횄횄횄횄횄횄횄횄횄횄횄횄횄횄횄횄횄횄횄횄횄횄횄횄횄횄횄횄횄횄횄횄횄횄횄횄횄횄횄횄횄횄횄횄횄횄횄횄횄횄횄횄횄횄횄횄횄횄횄횄횄횄횄횄횄횄횄횄횄횄횄횄횄횄횄횄횄횄횄횄횄횄횄횄횄횄횄횄횄횄횄횄횄횄횄횄횄횄횄횄횄횄횄횄횄횄횄횄횄횄횄횄횄횄횄횄횄횄횄횄횄횄횄횄횄횄횄횄횄횄횄횄횄횄횄횄횄횄횄횄횄횄횄횄횄횄횄횄횄횄횄횄횄횄횄횄횄횄횄횄횄횄횄횄횄횄횄횄횄횄횄횄횄횄횄횄횄횄횄횄횄횄횄횄횄횄횄횄횄횄횄횄횄횄횄횄횄횄횄횄횄횄횄횄횄횄횄횄횄횄횄횄횄횄횄횄횄횄횄횄횄횄횄횄횄횄횄횄횄횄횄횄횄횄횄횄횄횄횄횄횄횄횄횄횄횄횄횄횄횄횄횄횄횄횄횄횄횄횄횄횄횄횄횄횄횄횄횄횄횄횄횄횄횄횄횄횄횄횄횄횄횄횄횄횄횄횄횄횄횄횄횄횄횄횄횄횄횄횄횄횄횄횄횄횄횄횄횄횄횄횄횄횄횄횄횄횄횄횄횄횄횄횄횄횄횄횄횄횄횄횄횄횄횄횄횄횄횄횄횄횄횄횄횄횄횄횄횄횄횄횄횄횄횄횄횄횄횄횄횄횄횄횄횄횄횄횄횄횄횄횄횄횄횄횄횄횄횄횄횄횄횄횄횄횄횄횄횄횄횄횄횄횄횄횄횄횄횄횄횄횄횄횄횄횄횄횄횄횄횄횄횄횄횄횄횄횄횄횄횄횄횄횄횄횄횄횄횄횄횄횄횄횄횄횄횄횄횄횄횄횄횄횄횄횄횄횄횄횄횄횄횄횄횄횄횄횄횄횄횄횄횄횄횄횄횄횄횄횄횄횄횄횄횄횄횄횄횄횄횄횄횄횄횄횄횄횄횄횄횄횄횄횄횄횄횄횄횄횄횄횄횄횄횄횄횄횄횄횄횄횄횄횄횄횄횄횄횄횄횄횄횄횄횄횄횄횄횄횄횄횄횄횄횄횄횄횄횄횄횄횄횄횄횄횄횄횄횄횄횄횄횄횄횄횄횄횄횄횄횄횄횄횄횄횄횄횄횄횄횄횄횄횄횄횄횄횄횄횄횄횄횄횄횄횄횄횄횄횄횄횄횄횄횄횄횄횄횄횄횄횄횄횄횄횄횄횄횄횄횄횄횄횄횄횄횄횄횄횄횄횄횄횄횄횄횄횄횄횄횄횄횄횄횄횄횄횄횄횄횄횄횄횄횄횄횄횄횄횄횄횄횄횄횄횄횄횄횄횄횄횄횄횄횄횄횄횄횄횄횄횄횄횄횄횄횄횄횄횄횄횄횄횄횄횄횄횄횄횄횄횄횄횄횄횄횄횄횄횄횄횄횄횄횄횄횄횄횄횄횄횄횄횄횄횄횄횄횄횄횄횄횄횄횄횄횄횄횄횄횄횄횄횄횄횄횄횄횄횄횄횄횄횄횄횄횄횄횄횄횄횄횄횄횄횄횄횄횄횄횄횄횄횄횄횄횄횄횄횄횄횄횄횄횄횄횄횄횄횄횄횄횄횄횄횄횄횄횄횄횄횄횄횄횄횄횄횄횄횄횄횄횄횄횄횄횄횄횄횄횄횄횄횄횄횄횄횄횄횄횄횄횄횄횄횄횄횄횄횄횄횄횄횄횄횄횄횄횄횄횄횄횄횄횄횄횄횄횄횄횄횄횄횄횄횄횄횄횄횄횄횄횄횄횄횄횄횄횄횄횄횄횄횄횄횄횄횄횄횄횄횄횄횄횄횄횄횄횄횄횄횄횄횄횄횄횄횄횄횄횄횄횄횄횄횄횄횄횄횄횄횄횄횄횄횄횄횄횄횄횄횄횄횄횄횄횄횄횄횄횄횄횄횄횄횄횄횄횄횄횄횄횄횄횄횄횄횄횄횄횄횄횄횄횄횄횄횄횄횄횄횄횄횄횄횄횄횄횄횄횄횄횄횄횄횄횄횄횄횄횄횄횄횄횄횄횄횄횄횄횄횄횄횄횄횄횄횄횄횄횄횄횄횄횄횄횄횄횄횄횄횄횄횄횄횄횄횄횄횄횄횄횄횄횄횄횄횄횄횄횄횄횄횄횄횄횄횄횄횄횄횄횄횄횄횄횄횄횄횄횄횄횄횄횄횄횄횄횄횄횄횄횄횄횄횄횄횄횄횄횄횄횄횄횄횄횄횄횄횄횄횄횄횄횄횄횄횄횄횄횄횄횄횄횄횄횄횄횄횄횄횄횄횄횄횄횄횄횄횄횄횄횄횄횄횄횄횄횄횄횄횄횄횄횄횄횄횄횄횄횄횄횄횄횄횄횄횄횄횄횄횄횄횄횄횄횄횄횄횄횄횄횄횄횄횄횄횄횄횄횄횄횄횄횄횄횄횄횄횄횄횄횄횄횄횄횄횄횄횄횄횄횄횄횄횄횄횄횄횄횄횄횄횄횄횄횄횄횄횄횄횄횄횄횄횄횄횄횄횄횄횄횄횄횄횄횄횄횄횄횄횄횄횄횄횄횄횄횄횄횄횄횄횄횄횄횄횄횄횄횄횄횄횄횄횄횄횄횄횄횄횄횄횄횄횄횄횄횄횄횄횄횄횄횄횄횄횄횄횄횄횄횄횄횄횄횄횄횄횄횄횄횄횄횄횄횄횄횄횄횄횄횄횄횄횄횄횄횄횄횄횄횄횄횄횄횄횄횄횄횄횄횄횄횄횄횄횄횄횄횄횄횄횄횄횄횄횄횄횄횄횄횄횄횄횄횄횄횄횄횄횄횄횄횄횄횄횄횄횄횄횄횄횄횄횄횄횄횄횄횄횄횄횄횄횄횄횄횄횄횄횄횄횄횄횄횄횄횄횄횄횄횄횄횄횄횄횄횄횄횄횄횄횄횄횄횄횄횄횄횄횄횄횄횄횄횄횄횄횄횄횄횄횄횄횄횄횄횄횄횄횄횄횄횄횄횄횄횄횄횄횄횄횄횄횄횄횄횄횄횄횄횄횄횄횄횄횄횄횄횄횄횄횄횄횄횄횄횄횄횄횄횄횄횄횄횄횄횄횄횄횄횄횄횄횄횄횄횄횄횄횄횄횄횄횄횄횄횄횄횄횄횄횄횄횄횄횄횄횄횄횄횄횄횄횄횄횄횄횄횄횄횄횄횄횄횄횄횄횄횄횄횄횄횄횄횄횄횄횄횄횄횄횄횄횄횄횄횄횄횄횄횄횄횄횄횄횄횄횄횄횄횄횄횄횄횄횄횄횄횄횄횄횄횄횄횄횄횄횄횄횄횄횄횄횄횄횄횄횄횄횄횄횄횄횄횄횄횄횄횄횄횄횄횄횄횄횄횄횄횄횄횄횄횄횄횄횄횄횄횄횄횄횄횄횄횄횄횄횄횄횄횄횄횄횄횄횄횄횄횄횄횄횄횄횄횄횄횄횄횄횄횄횄횄횄횄횄횄횄횄횄횄횄횄횄횄횄횄횄횄횄횄횄횄횄횄횄횄횄횄횄횄횄횄횄횄횄횄횄횄횄횄횄횄횄횄횄횄횄횄횄횄횄횄횄횄횄횄횄횄횄횄횄횄횄횄횄횄횄횄횄횄횄횄횄횄횄횄횄횄횄횄횄횄횄횄횄횄횄횄횄횄횄횄횄횄횄횄횄횄횄횄횄횄횄횄횄횄횄횄횄횄횄횄횄횄횄횄횄횄횄횄횄횄횄횄횄횄횄횄횄횄횄횄횄횄횄횄횄횄횄횄횄횄횄횄횄횄횄횄횄횄횄횄횄횄횄횄횄횄횄횄횄횄횄횄횄횄횄횄횄횄횄횄횄횄횄횄횄횄횄횄횄횄횄횄횄횄횄횄횄횄횄횄횄횄횄횄횄횄횄횄횄횄횄횄횄횄횄횄횄횄횄횄횄횄횄횄횄횄횄횄횄횄횄횄횄횄횄횄횄횄횄횄횄횄횄횄횄횄횄횄횄횄횄횄횄횄횄횄횄횄횄횄횄횄횄횄횄횄횄횄횄횄횄횄횄횄횄횄횄횄횄횄횄횄횄횄횄횄횄횄횄횄횄횄횄횄횄횄횄횄횄횄횄횄횄횄횄횄횄횄횄횄횄횄횄횄횄횄횄횄횄횄횄횄횄횄횄횄횄횄횄횄횄횄횄횄횄횄횄횄횄횄횄횄횄횄횄횄횄횄횄횄횄횄횄횄횄횄횄횄횄횄횄횄횄횄횄횄횄횄횄횄횄횄횄횄횄횄횄횄횄횄횄횄횄횄횄횄횄횄횄횄횄횄횄횄횄횄횄횄횄횄횄횄횄횄횄횄횄횄횄횄횄횄횄횄횄횄횄횄횄횄횄횄횄횄횄횄횄횄횄횄횄횄횄횄횄횄횄횄횄횄횄횄횄횄횄횄횄횄횄횄횄횄횄횄횄횄횄횄횄횄횄횄횄횄횄횄횄횄횄횄횄횄횄횄횄횄횄횄횄횄횄횄횄횄횄횄횄횄횄횄횄횄횄횄횄횄횄횄횄횄횄횄횄횄횄횄횄횄횄횄횄횄횄횄횄횄횄횄횄횄횄횄횄횄횄횄횄횄횄횄횄횄횄횄횄횄횄횄횄횄횄횄횄횄횄횄횄횄횄횄횄횄횄횄횄횄횄횄횄횄횄횄횄횄횄횄횄횄횄횄횄횄횄횄횄횄횄횄횄횄횄횄횄횄횄횄횄횄횄횄횄횄횄횄횄횄횄횄횄횄횄횄횄횄횄횄횄횄횄횄횄횄횄횄횄횄횄횄횄횄횄횄횄횄횄횄횄횄횄횄횄횄횄횄횄횄횄횄횄횄횄횄횄횄횄횄횄횄횄횄횄횄횄횄횄횄횄횄횄횄횄횄횄횄횄횄횄횄횄횄횄횄횄횄횄횄횄횄횄횄횄횄횄횄횄횄횄횄횄횄횄횄횄횄횄횄횄횄횄횄횄횄횄횄횄횄횄횄횄횄횄횄횄횄횄횄횄횄횄횄횄횄횄횄횄횄횄횄횄횄횄횄횄횄횄횄횄횄횄횄횄횄횄횄횄횄횄횄횄횄횄횄횄횄횄횄횄횄횄횄횄횄횄횄횄횄횄횄횄횄횄횄횄횄횄횄횄횄횄횄횄횄횄횄횄횄횄횄횄횄횄횄횄횄횄횄횄횄횄횄횄횄횄횄횄횄횄횄횄횄횄횄횄횄횄횄횄횄횄횄횄횄횄횄횄횄횄횄횄횄횄횄횄횄횄횄횄횄횄횄횄횄횄횄횄횄횄횄횄횄횄횄횄횄횄횄횄횄횄횄횄횄횄횄횄횄횄횄횄횄횄횄횄횄횄횄횄횄횄횄횄횄횄횄횄횄횄횄횄횄횄횄횄횄횄횄횄횄횄횄횄횄횄횄횄횄횄횄횄횄횄횄횄횄횄횄횄횄횄횄횄횄횄횄횄횄횄횄횄횄횄횄횄횄횄횄횄횄횄횄횄횄횄횄횄횄횄횄횄횄횄횄횄횄횄횄횄횄횄횄횄횄횄횄횄횄횄횄횄횄횄횄횄횄횄횄횄횄횄횄횄횄횄횄횄횄횄횄횄횄횄횄횄횄횄횄횄횄횄횄횄횄횄횄횄횄횄횄횄횄횄횄횄횄횄횄횄횄횄횄횄횄횄횄횄횄횄횄횄횄횄횄횄횄횄횄횄횄횄횄횄횄횄횄횄횄횄횄횄횄횄횄횄횄횄횄횄횄횄횄횄횄횄횄횄횄횄횄횄횄횄횄횄횄횄횄횄횄횄횄횄횄횄횄횄횄횄횄횄횄횄횄횄횄횄횄횄횄횄횄횄횄횄횄횄횄횄횄횄횄횄횄횄횄횄횄횄횄횄횄횄횄횄횄횄횄횄횄횄횄횄횄횄횄횄횄횄횄횄횄횄횄횄횄횄횄횄횄횄횄횄횄횄횄횄횄횄횄횄횄횄횄횄횄횄횄횄횄횄횄횄횄횄횄횄횄횄횄횄횄횄횄횄횄횄횄횄횄횄횄횄횄횄횄횄횄횄횄횄횄횄횄횄횄횄횄횄횄횄횄횄횄횄횄횄횄횄횄횄횄횄횄횄횄횄횄횄횄횄횄횄횄횄횄횄횄횄횄횄횄횄횄횄횄횄횄횄횄횄횄횄횄횄횄횄횄횄횄횄횄횄횄횄횄횄횄횄횄횄횄횄횄횄횄횄횄횄횄횄횄횄횄횄횄횄횄횄횄횄횄횄횄횄횄횄횄횄횄횄횄횄횄횄횄횄횄횄횄횄횄횄횄횄횄횄횄횄횄횄횄횄횄횄횄횄횄횄횄횄횄횄횄횄횄횄횄횄횄횄횄횄횄횄횄횄횄횄횄횄횄횄횄횄횄횄횄횄횄횄횄횄횄횄횄횄횄횄횄횄횄횄횄횄횄횄횄횄횄횄횄횄횄횄횄횄횄횄횄횄횄횄횄횄횄횄횄횄횄횄횄횄횄횄횄횄횄횄횄횄횄횄횄횄횄횄횄횄횄횄횄횄횄횄횄횄횄횄횄횄횄횄횄횄횄횄횄횄횄횄횄횄횄횄횄횄횄횄횄횄횄횄횄횄횄횄횄횄횄횄횄횄횄횄횄횄횄횄횄횄횄횄횄횄횄횄횄횄횄횄횄횄횄횄횄횄횄횄횄횄횄횄횄횄횄횄횄횄횄횄횄횄횄횄횄횄횄횄횄횄횄횄횄횄횄횄횄횄횄횄횄횄횄횄횄횄횄횄횄횄횄횄횄횄횄횄횄횄횄횄횄횄횄횄횄횄횄횄횄횄횄횄횄횄횄횄횄횄횄횄횄횄횄횄횄횄횄횄횄횄횄횄횄횄횄횄횄횄횄횄횄횄횄횄횄횄횄횄횄횄횄횄횄횄횄횄횄횄횄횄횄횄횄횄횄횄횄횄횄횄횄횄횄횄횄횄횄횄횄횄횄횄횄횄횄횄횄횄횄횄횄횄횄횄횄횄횄횄횄횄횄횄횄횄횄횄횄횄횄횄횄횄횄횄횄횄횄횄횄횄횄횄횄횄횄횄횄횄횄횄횄횄횄횄횄횄횄횄횄횄횄횄횄횄횄횄횄횄횄횄횄횄횄횄횄횄횄횄횄횄횄횄횄횄횄횄횄횄횄횄횄횄횄횄횄횄횄횄횄횄횄횄횄횄횄횄횄횄횄횄횄횄횄횄횄횄횄횄횄횄횄횄횄횄횄횄횄횄횄횄횄횄횄횄횄횄횄횄횄횄횄횄횄횄횄횄횄횄횄횄횄횄횄횄횄횄횄횄횄횄횄횄횄횄횄횄횄횄횄횄횄횄횄횄횄횄횄횄횄횄횄횄횄횄횄횄횄횄횄횄횄횄횄횄횄횄횄횄횄횄횄횄횄횄횄횄횄횄횄횄횄횄횄횄횄횄횄횄횄횄횄횄횄횄횄횄횄횄횄횄횄횄횄횄횄횄횄횄횄횄횄횄횄횄횄횄횄횄횄횄횄횄횄횄횄횄횄횄횄횄횄횄횄횄횄횄횄횄횄횄횄횄횄횄횄횄횄횄횄횄횄횄횄횄횄횄횄횄횄횄횄횄횄횄횄횄횄횄횄횄횄횄횄횄횄횄횄횄횄횄횄횄횄횄횄횄횄횄횄횄횄횄횄횄횄횄횄횄횄횄횄횄횄횄횄횄횄횄횄횄횄횄횄횄횄횄횄횄횄횄횄횄횄횄횄횄횄횄횄횄횄횄횄횄횄횄횄횄횄횄횄횄횄횄횄횄횄횄횄횄횄횄횄횄횄횄횄횄횄횄횄횄횄횄횄횄횄횄횄횄횄횄횄횄횄횄횄횄횄횄횄횄횄횄횄횄횄횄횄횄횄횄횄횄횄횄횄횄횄횄횄횄횄횄횄횄횄횄횄횄횄횄횄횄횄횄횄횄횄횄횄횄횄횄횄횄횄횄횄횄횄횄횄횄횄횄횄횄횄횄횄횄횄횄횄횄횄횄횄횄횄횄횄횄횄횄횄횄횄횄횄횄횄횄횄횄횄횄횄횄횄횄횄횄횄횄횄횄횄횄횄횄횄횄횄횄횄횄횄횄횄횄횄횄횄횄횄횄횄횄횄횄횄횄횄횄횄횄횄횄횄횄횄횄횄횄횄횄횄횄횄횄횄횄횄횄횄횄횄횄횄횄횄횄횄횄횄횄횄횄횄횄횄횄횄횄횄횄횄횄횄횄횄횄횄횄횄횄횄횄횄횄횄횄횄횄횄횄횄횄횄횄횄횄횄횄횄횄횄횄횄횄횄횄횄횄횄횄횄횄횄횄횄횄횄횄횄횄횄횄횄횄횄횄횄횄횄횄횄횄횄횄횄횄횄횄횄횄횄횄횄횄횄횄횄횄횄횄횄횄횄횄횄횄횄횄횄횄횄횄횄횄횄횄횄횄횄횄횄횄횄횄횄횄횄횄횄횄횄횄횄횄횄횄횄횄횄횄횄횄횄횄횄횄횄횄횄횄횄횄횄횄횄횄횄횄횄횄횄횄횄횄횄횄횄횄횄횄횄횄횄횄횄횄횄횄횄횄횄횄횄횄횄횄횄횄횄횄횄횄횄횄횄횄횄횄횄횄횄횄횄횄횄횄횄횄횄횄횄횄횄횄횄횄횄횄횄횄횄횄횄횄횄횄횄횄횄횄횄횄횄횄횄횄횄횄횄횄횄횄횄횄횄횄횄횄횄횄횄횄횄횄횄횄횄횄횄횄횄횄횄횄횄횄횄횄횄횄횄횄횄횄횄횄횄횄횄횄횄횄횄횄횄횄횄횄횄횄횄횄횄횄횄횄횄횄횄횄횄횄횄횄횄횄횄횄횄횄횄횄횄횄횄횄횄횄횄횄횄횄횄횄횄횄횄횄횄횄횄횄횄횄횄횄횄횄횄횄횄횄횄횄횄횄횄횄횄횄횄횄횄횄횄횄횄횄횄횄횄횄횄횄횄횄횄횄횄횄횄횄횄횄횄횄횄횄횄횄횄횄횄횄횄횄횄횄횄횄횄횄횄횄횄횄횄횄횄횄횄횄횄횄횄횄횄횄횄횄횄횄횄횄횄횄횄횄횄횄횄횄횄횄횄횄횄횄횄횄횄횄횄횄횄횄횄횄횄횄횄횄횄횄횄횄횄횄횄횄횄횄횄횄횄횄횄횄횄횄횄횄횄횄횄횄횄횄횄횄횄횄횄횄횄횄횄횄횄횄횄횄횄횄횄횄횄횄횄횄횄횄횄횄횄횄횄횄횄횄횄횄횄횄횄횄횄횄횄횄횄횄횄횄횄횄횄횄횄횄횄횄횄횄횄횄횄횄횄횄횄횄횄횄횄횄횄횄횄횄횄횄횄횄횄횄횄횄횄횄횄횄횄횄횄횄횄횄횄횄횄횄횄횄횄횄횄횄횄횄횄횄횄횄횄횄횄횄횄횄횄횄횄횄횄횄횄횄횄횄횄횄횄횄횄횄횄횄횄횄횄횄횄횄횄횄횄횄횄횄횄횄횄횄횄횄횄횄횄횄횄횄횄횄횄횄횄횄횄횄횄횄횄횄횄횄횄횄횄횄횄횄횄횄횄횄횄횄횄횄횄횄횄횄횄횄횄횄횄횄횄횄횄횄횄횄횄횄횄횄횄횄횄횄횄횄횄횄횄횄횄횄횄횄횄횄횄횄횄횄횄횄횄횄횄횄횄횄횄횄횄횄횄횄횄횄횄횄횄횄횄횄횄횄횄횄횄횄횄횄횄횄횄횄횄횄횄횄횄횄횄횄횄횄횄횄횄횄횄횄횄횄횄횄횄횄횄횄횄횄횄횄횄횄횄횄횄횄횄횄횄횄횄횄횄횄횄횄횄횄횄횄횄횄횄횄횄횄횄횄횄횄횄횄횄횄횄횄횄횄횄횄횄횄횄횄횄횄횄횄횄횄횄횄횄횄횄횄횄횄횄횄횄횄횄횄횄횄횄횄횄횄횄횄횄횄횄횄횄횄횄횄횄횄횄횄횄횄횄횄횄횄횄횄횄횄횄횄횄횄횄횄횄횄횄횄횄횄횄횄횄횄횄횄횄횄횄횄횄횄횄횄횄횄횄횄횄횄횄횄횄횄횄횄횄횄횄횄횄횄횄횄횄횄횄횄횄횄횄횄횄횄횄횄횄횄횄횄횄횄횄횄횄횄횄횄횄횄횄횄횄횄횄횄횄횄횄횄횄횄횄횄횄횄횄횄횄횄횄횄횄횄횄횄횄횄횄횄횄횄횄횄횄횄횄횄횄횄횄횄횄횄횄횄횄횄횄횄횄횄횄횄횄횄횄횄횄횄횄횄횄횄횄횄횄횄횄횄횄횄횄횄횄횄횄횄횄횄횄횄횄횄횄횄횄횄횄횄횄횄횄횄횄횄횄횄횄횄횄횄횄횄횄횄횄횄횄횄횄횄횄횄횄횄횄횄횄횄횄횄횄횄횄횄횄횄횄횄횄횄횄횄횄횄횄횄횄횄횄횄횄횄횄횄횄횄횄횄횄횄횄횄횄횄횄횄횄횄횄횄횄횄횄횄횄횄횄횄횄횄횄횄횄횄횄횄횄횄횄횄횄횄횄횄횄횄횄횄횄횄횄횄횄횄횄횄횄횄횄횄횄횄횄횄횄횄횄횄횄횄횄횄횄횄횄횄횄횄횄횄횄횄횄횄횄횄횄횄횄횄횄횄횄횄횄횄횄횄횄횄횄횄횄횄횄횄횄횄횄횄횄횄횄횄횄횄횄횄횄횄횄횄횄횄횄횄횄횄횄횄횄횄횄횄횄횄횄횄횄횄횄횄횄횄횄횄횄횄횄횄횄횄횄횄횄횄횄횄횄횄횄횄횄횄횄횄횄횄횄횄횄횄횄횄횄횄횄횄횄횄횄횄횄횄횄횄횄횄횄횄횄횄횄횄횄횄횄횄횄횄횄횄횄횄횄횄횄횄횄횄횄횄횄횄횄횄횄횄횄횄횄횄횄횄횄횄횄횄횄횄횄횄횄횄횄횄횄횄횄횄횄횄횄횄횄횄횄횄횄횄횄횄횄횄횄횄횄횄횄횄횄횄횄횄횄횄횄횄횄횄횄횄횄횄횄횄횄횄횄횄횄횄횄횄횄횄횄횄횄횄횄횄횄횄횄횄횄횄횄횄횄횄횄횄횄횄횄횄횄횄횄횄횄횄횄횄횄횄횄횄횄횄횄횄횄횄횄횄횄횄횄횄횄횄횄횄횄횄횄횄횄횄횄횄횄횄횄횄횄횄횄횄횄횄횄횄횄횄횄횄횄횄횄횄횄횄횄횄횄횄횄횄횄횄횄횄횄횄횄횄횄횄횄횄횄횄횄횄횄횄횄횄횄횄횄횄횄횄횄횄횄횄횄횄횄횄횄횄횄횄횄횄횄횄횄횄횄횄횄횄횄횄횄횄횄횄횄횄횄횄횄횄횄횄횄횄횄횄횄횄횄횄횄횄횄횄횄횄횄횄횄횄횄횄횄횄횄횄횄횄횄횄횄횄횄횄횄횄횄횄횄횄횄횄횄횄횄횄횄횄횄횄횄횄횄횄횄횄횄횄횄횄횄횄횄횄횄횄횄횄횄횄횄횄횄횄횄횄횄횄횄횄횄횄횄횄횄횄횄횄횄횄횄횄횄횄횄횄횄횄횄횄횄횄횄횄횄횄횄횄횄횄../../../../../../../..//횄
0x17a8f2,"Heh heh heh... E agora, hora de dar uma olhada\n"
0x17a91f,nesse tesouro...
0x17a933,Todos os trof챕us roubados pertencem a mim agora...\n
0x17a962,e agora posso come챌ar a viver de boa...
0x17a992,"T찼 maquinando algo, n찾o t찼?"
0x17a9bf,Que tal a gente dar uma olhada no... Hein?
0x17a9f3,"Quando volto 횪 realidade, de repente sinto um cheiro\n"
0x17aa27,algo queimando.
0x17aa3a,...Qu챗?
0x17aa43,"Meu est척mago aperta, e me viro para encontrar...\n"
0x17aa74,esconderijo dos bandidos em chamas.
0x17aa9d,Hein?
0x17aaa2,"O fogo dan챌a e sobe, lan챌ando uma luz quente\n"
0x17aad4,"sobre as cavernas, como uma tocha gigante piscante."
0x17ab05,C-Que!? Fogo!? C-Como!?
0x17ab1b,Que belo inc챗ndio.\n
0x17ab3b,Ousaria dizer que o espet찼culo 챕 um fim apropriado\n
0x17ab66,pra uma noite de vit처ria.
0x17ab7d,Q-Que 챕 isso... Como pegou fogo!?\n
0x17abaa,O que causou isso!?
0x17abd1,"Bom, sobre as bombas de fuma챌a...\n"
0x17abf4,Eu acho que mencioni que eram meio inst찼veis.
0x17ac24,Por que n찾o DISSE--P-Precisa apagar AGORA!
0x17ac56,"N-N찾o d찼. Com o fogo desse tamanho,\n"
0x17ac82,n찾o tem jeito de parar...
0x17ac9c,Ainda d찼 tempo! 횁gua!\n
0x17acb8,Cad챗 a 찼gua!?
0x17accc,E-Eu... acho que vejo um balde ali...?
0x17acfa,fora!
0x17ad00,Ah--
0x17ad05,Isso--
0x17ad0e,Tome isso!
0x17ad19,AAAAAAAAAH!?
0x17ad25,"No momento em que jogo 찼gua, o fogo se intensifica\n"
0x17ad53,come챌a a queimar ainda mais forte.
0x17ad71,"Quente, MUITO quente! O que t찼 acontecendo!?"
0x17ad8d,Acredito que o que voc챗 jogou no fogo era 처leo.\n
0x17adc1,Claro que queima mais feroz.
0x17ade7,횙LEO!? Quem diabos deixa um balde de 처leo\n
0x17ae13,por ali!?
0x17ae22,"As plataformas de madeira pegam fogo ainda mais, antes de\n"
0x17ae54,come챌ando a desabar com um estrondo.
0x17ae82,T-T찼 queimando... tudo queimando...
0x17aea3,"O que voc챗 est찼 fazendo, Haku!?\n"
0x17aec0,횋 perigoso entrar l찼!
0x17aed9,Me solte! Minha vida de luxo!\n
0x17aefc,Quase consigo sentir o gosto...!
0x17af18,Do que voc챗 est찼 falando!?\n
0x17af37,Voc챗 vai se matar l찼 dentro!
0x17af5f,"Kiwru corre at챕 mim 횪s pressas, me segurando.\n"
0x17af90,"O fogo queima alegremente, se espalhando pelo acampamento."
0x17afc3,Por qu챗...? N찾o era pra ser assim...
0x17aff1,"Em breve n찾o restar찼 mais que cinzas. Caio de joelhos,\n"
0x17b026,socando o ch찾o miseravelmente.
0x17b055,"F찼cil vem, f찼cil vai, como dizem."
0x17b07d,E este 챕 um exemplo perfeito disso.\n
0x17b0a2,Que muito educativo.
0x17b0b8,Isso s처 prova que a melhor forma de\n
0x17b0e9,dinheiro 챕 atrav챕s de trabalho duro e honesto.
