offset,text_source,byte_budget
0x22595,Urp...,6
0x2259c,Blurgh. I ate way too much. I feel like food's gonna\n,54
0x225d3,come out the wrong way if I open my mouth...,44
0x22600,"As I lie down rubbing my stomach, Kuon digs through\n",53
0x22636,"her bags, searching for something.",34
0x22659,How can she still move around like that? She ate\n,50
0x2268c,more than double her own body weight...,39
0x226b4,She REALLY doesn't look like she eats as much as she\n,54
0x226eb,"does. Where does it all go, with that figure?",45
0x22719,Hmmhmm...,9
0x22723,What are you doing?,19
0x22737,"She seems to be in a good mood, humming to herself\n",52
0x2276c,happily.,8
0x22775,"Eh heh heh. Getting ready to take a bath, of course.",52
0x227aa,"I've just been wiping down for the past few days,\n",51
0x227de,"so as long as we have baths, I'm taking advantage.",50
0x22811,Kuon has a dreamy look on her face...,37
0x22837,"A bath, huh? You can't get a proper one on the road,\n",54
0x2286e,that's for sure.,16
0x2287f,"It's too bad we can't soak, but a bath's a bath.",48
0x228b0,"Huh? It's a bath, but you can't soak in it?",43
0x228dc,"Oh, they're steam baths! They're much more common\n",51
0x22910,than baths with running water around here.,42
0x2293b,"Ah, I see.",10
0x22946,"No hot tubs, then... I'd prefer a good soak, but a\n",52
0x2297b,steam bath still sounds pretty good right now.,46
0x229aa,"You should go take one later, too. It'll melt away\n",52
0x229df,"the fatigue and cleanse you, body and soul.",43
0x22a0b,Guess you're right...,21
0x22a21,"Now that she mentions it, I did sweat a whole lot\n",51
0x22a55,exerting myself on the trek earlier...,38
0x22a7c,"Too bad about the hot water, but it'll feel nice to\n",53
0x22ab2,relax in the steam.,19
0x22ac6,"All right, I'll go do that, then.",33
0x22ae8,Uh.,3
0x22aec,Kuon makes a noise as if she's suddenly remembering\n,53
0x22b22,something.,10
0x22b2d,Uh... hm. Hmm...,16
0x22b3e,"Then she puts a finger to her chin, deep in thought.",52
0x22b73,...Why is she looking at me like that?,38
0x22b9a,"I still have a few things I need to take care of,\n",51
0x22bce,actually.,9
0x22bd8,Hm?,3
0x22bdc,"Yeah. It might take a while, so why don't you go\n",50
0x22c0f,take a bath first?,18
0x22c22,"Oh, I don't mind waiting.",25
0x22c3c,"My stomach's so full, I don't think I can move from\n",53
0x22c72,"this spot anyway. Besides, I want to relax.",43
0x22c9e,"No, you're probably tired, right? Go ahead and take\n",53
0x22cd4,it now. Here--a spare change of clothes for you.,48
0x22d05,She pushes a set of clothes into my hands. When did\n,53
0x22d3b,she put those together?,23
0x22d53,"You haven't forgotten how to take a bath, right?",48
0x22d84,"I seriously doubt that. I mean, I HOPE I haven't.",49
0x22db6,Then you should be fine on your own. Don't worry\n,50
0x22de9,"about me and go relax, OK?",26
0x22e04,If you insist...,16
0x22e15,"I have a weird feeling about this, but it'd be rude\n",53
0x22e4b,"to refuse her goodwill, so...",29
0x22e69,"The bath's downstairs and to the left, at the end\n",51
0x22e9d,"of the corridor, OK?",20
0x22eb2,"OK, got it.",11
0x22ebe,"As I leave the room and head left, a long hallway\n",51
0x22ef2,"greets me, as promised.",23
0x22f0a,The door at the end of the hall opens into something\n,54
0x22f41,"like a changing room, lined with shelves.",41
0x22f6b,Doesn't seem like anyone else is using the bath\n,49
0x22f9d,right now. I should be able to unwind without worry.,52
0x22fd2,I untie my sash and toss my clothes haphazardly\n,49
0x23004,onto a random shelf.,20
0x23019,I open another door at the far end of the changing\n,52
0x2304e,"room, and a blast of hot air washes over me...",46
0x2307d,The bath beyond is spacious for an inn like this.\n,51
0x230b1,"Benches line the walls, enough to seat five people.",51
0x230e5,Set into the opposite wall is something like a\n,48
0x23116,"furnace without an opening, fenced in by wood.",46
0x23145,"Judging by the heat waves rising from it, you\n",47
0x23175,probably pour water over that to make the steam...,50
0x231a8,Hoomph. Ah...,13
0x231b6,I flop onto one of the wooden benches and let out\n,51
0x231ea,a deep sigh.,12
0x231f7,The room's warmth suffuses me. I didn't realize how\n,53
0x2322d,good this would feel.,21
0x23243,Ahhh...,7
0x2324b,"I zone out, staring up at the ceiling and thinking.\n",53
0x23281,The day's events wash over me...,32
0x232a2,I woke up in a strange place...,31
0x232c2,"Then, a monstrous creature attacked me, only for\n",50
0x232f5,Kuon to save me in the nick of time.,36
0x2331a,"And now, here I am with no memory, no belongings,\n",51
0x2334e,no power. No place to go home to. A lot of nothing.,51
0x23382,What am I going to do...?,25
0x2339c,"Bah, no point stressing over it. As it stands,\n",48
0x233cd,I can't do much but trust in Kuon's hospitality.,48
0x233fe,We'll see how things play out...,32
0x2341f,"Taking a ladle from the bench, I throw water over\n",51
0x23453,the heating apparatus.,22
0x2346a,The hiss of evaporating water and a cloud of steam\n,52
0x2349f,"fill the room, heating the air.",31
0x234bf,"Gah. I walked so much, my calves are all swollen.",49
0x234f1,"The arches of my feet, too. Ow.",31
0x23511,A dull pain shoots through my foot when I try to\n,50
0x23544,rub the ache away...,20
0x23559,"Perturbed, I lift my foot, looking at the sole to\n",51
0x2358d,find the source of the pain...,30
0x235ac,Huh?,4
0x235b1,A loud thud interrupts me from the other side of\n,50
0x235e4,the wall.,9
0x235ee,"What the... Did something collapse? Doesn't matter,\n",53
0x23624,I guess.,8
0x2362d,I look back down at the poor sole of my foot--rife\n,52
0x23662,"with blisters, some of them torn and bloodied.",46
0x23691,"Yikes, the skin's peeling, too. I guess we did walk\n",53
0x236c7,a pretty long way...,20
0x236dc,Probably better not to touch that. Left with no\n,49
0x2370e,"choice, I return to massaging my sore calves\n",46
0x2373d,instead.,8
0x23746,...Huh?,7
0x2374e,"Suddenly, I get the feeling I'm being watched.",46
0x2377d,"I glance around the steam-filled room, but of\n",47
0x237ad,"course, no one is in here with me...",36
0x237d2,...Probably just my imagination.,32
0x237f3,"Oh, well. I should loosen up my other muscles while\n",53
0x23829,I'm in here--it's not just my calves that hurt.,47
0x23859,Up we go...,11
0x23865,"Careful of my feet, I ease myself up and stand\n",48
0x23896,"upright, stretching out my whole body.",38
0x238bd,"*Flutter, fwumph*",17
0x238cf,*THUNK*,7
0x238d7,"Oops, the washcloth around my waist is--wait, there's\n",55
0x2390f,that noise again. Where's that coming from?,43
0x2393b,"*Squeeeaak. Squeak, squeak, chirp.*",35
0x2395f,...some kind of small animal? Who knows what weird\n,52
0x23994,creatures the innkeeper might have around...,44
0x239c1,"Well, no big deal. As long as it minds its own\n",48
0x239f2,"business. Now, I'll start with some loosening up...",51
0x23a26,Shake-shake-shake-shake--,25
0x23a40,"*Thwap, fwup, thwap--*",22
0x23a57,"*WHOMP, CRASH, THUNK*",21
0x23a6d,Gyeek!,6
0x23a74,That thing's making a lot of noise out there. What's\n,54
0x23aab,with the ruckus?,16
0x23abc,"Whatever. Next, some hip swivels--",34
0x23adf,"Hup! Hup, hmph, hah!",20
0x23af4,"*Thwip, thwip, thwap--*",23
0x23b0c,*THUNK*\n,9
0x23b16,"*Rattle, rattle*...",19
0x23b2a,"All right, here we go! Pick up the pace!",40
0x23b53,"*Jiggle, jiggle, thwip--*",25
0x23b6d,*WHUMP* *clatter*,17
0x23b7f,Fwaaaaaaaaah!!...,17
0x23b91,Something crashes loudly and scampers off...,44
0x23bbe,Just animals fighting. I don't really know the\n,48
0x23bef,"seasons here, but I guess spring must be close.",47
0x23c1f,"Loosened up, I sit back down on the bench and\n",47
0x23c4f,surrender myself to the relaxing steam.,39
0x23c77,"Ahhh, that hits the spot...",27
